{
  "schema_version": "1",
  "corpus": "magento-malware-scanner",
  "corpus_pin": "10539a47c5874ec2b19b1a216be5d3f99dbcea73",
  "candidate_url": "https://github.com/gwillem/magento-malware-scanner",
  "smith_decision": "no-go",
  "supersedes": "triage-trial (#312)",
  "reason": "SUPERSEDING NO-GO: probe count (246) inflated by corpus/ malware-sample directory (206 sites in 30 files - data samples, not scanner code). Real scanner surface is 40 sites in 13 files (docs/analysis + tools/build_rules.py + mwscan/ruleset.py). Magento malware-detection class already covered by the 25+ admitted yara/malware corpora. No novel encodable surface.",
  "regex_sites": 246,
  "sites_by_bucket": {
    "corpus/ malware samples (30 files)": 206,
    "real scanner code (13 files)": 40
  },
  "additional_surface_outside_probe_scope": {}
}
